,Unnamed: 0,Unnamed: 0.1,title,description,body,keyword,ne,cluster,vector,author,section,month,year,keyword_e,ne_e,cluster_e,vecctor_e
0,0,0,S. Korean culture seeping into N.Korea,"The reclusive country of North Korea is seeing a growing influx of information from the outside world, according to a high-profile defector, as South Korean pop culture is spreading among the North’s citizens.A recent press conference by former North Korean diplomat Thae Yong-ho revealed that an increasing number of North Koreans are watching South Korean dramas, which affects their daily lives.“It depends on the c...","The reclusive country of North Korea is seeing a growing influx of information from the outside world, according to a high-profile defector, as South Korean pop culture is spreading among the North’s citizens.A recent press conference by former North Korean diplomat Thae Yong-ho revealed that an increasing number of North Koreans are watching South Korean dramas, which affects their daily lives.“It depends on the class, but there is not one North Korean who hasn’t seen  South Korean drama or movie as far as I know,” he told reporters. “It’s no longer easy for the regime to cut off Hallyu.”Hallyu refers to the popularity of South Korean popular culture, which has grown prominent in other countries, especially in Asia. It ranges from dramas, movies and K-pop to TV shows like “Running Man,” which has an especially large following in Southeast Asian countries.North Korea, one of the poorest countries in the world, has been controlling the flow of information from the outside world. This is to back its propaganda about the self-proclaimed excellence of the Kim Jong-un regime and the supposed malicious and depraved nature of other countries. Professor Kang Dong-wan of South Korea’s Donga University shows a Chinese EVD portable video-playing device, referred to as “Note TV or Note-tel” by North Koreans, in this photo dated Nov. 22, 2013. Former North Korean defectors recently testified at a forum in New York that bringing in information from the outside world -- which often take place on the sidelines of smuggling -- is considered one of the worst crimes in the country. But technological advances and the growth of the black market in the hermit kingdom has made it more difficult to keep the citizens from accessing outside media. The South Korean Unification Ministry believes that the North’s central distribution system collapsed in the mid-1990s. One of the most popular means of enjoying Hallyu is said to be Notetel, a type of portable media player that plays DVDs and enhanced versatile discs. It was legalized in 2014 under the condition that it is limited to certain channels of the regime’s choice.Thae testified that any North Korean who works abroad can easily access the internet via smart devices, although the regime urges them not to. They are, however, prevented from conveying the information they learned to others, due to the authorities spying on them upon their return to North Korea.“North Korea’s control over the internet is crumbling, and Kim knows it,” he said.Exposure to South Korean culture is affecting North Korean lives as well. According to Thae, young North Koreans even talk like South Koreans. Although the two Koreas have the same language, regional dialects and their 66-year separation have resulted in their citizens speaking in a very different manner.“They say words like ‘jagiya’ , ‘oppa’ , ‘kkk’ , which don’t even exist in the North Korean language,” he said.Using these words is subject to the authorities’ crackdown, but Thae said it can be fixed by paying certain fees to the authorities. “North Korea attempts to control its people, but there are two things you just can’t stop. Drugs and Hallyu,” he said.He said the exposure to South Korean culture is slowly bringing the Kim regime down from the inside. “The Kim regime appears stable from the outside, but is rotting from the inside. ... We  hail Kim Jong-un during the daytime and watch South Korean films and dramas at night under blankets,” he said. Thae said this is why Kim keeps such close tabs on the country’s elites and executes anyone who falls out of line. “I was afraid that the ‘slave life’ will continue until the time of my grandchildren’s children. I told my family that I am severing the chains the moment I leave the embassy,” he said.By Yoon Min-sik","watching south korean dramas ,culture seeping into korea ,south korean pop culture ,korean culture seeping ,korean culture seeping into","['North Korea', 'south korean', 'North ’s', 'north korean', 'North Koreans', 'south korean']",14,"[ 1.          2.          1.         ... -0.19060008  0.90817416
  0.11252501]",Yoon Min-sik,North Korea,12,2016,"korean defectors recently testified at ,are watching south korean dramas ,north korean defectors recently testified ,young north koreans even talk ,north korean defectors recently","['North Korea', 'south korean', 'North ’s', 'north korean', 'North Koreans', 'south korean', 'north Korean', 'south korean', 'Hallyu', 'south korean', 'k - pop', 'southeast asian', 'North Korea', 'Kim Jong - un', 'Kang Dong - wan', 'South Korea ’s', 'Donga University', 'chinese', 'EVD', 'North Koreans', 'north korean', 'New York', 'the south Korean Unification Ministry', 'Hallyu', 'Notetel', 'North Korean', 'North Korea', 'Korea', 'Kim', 'south korean', 'north korean', 'North Koreans', 'South Koreans', 'Koreas', 'north korean', 'Thae', 'North Korea', 'Hallyu', 'south korean', 'Kim', 'Kim', 'Kim Jong - un', 'south korean', 'Kim', 'Yoon Min - sik']",19,"[ 1.          2.          1.         ... -0.19060008  0.90817416
  0.11252501]"
1,1,1,Youngjae-oh nurtures gifted children,"For South Korean parents, education is a top priority for their children and there is often keen interest in nurturing their talent. The Afternoon School for the Gifted, or Youngjae-oh in Korean, is an education center that is a key player in the development of education for the gifted. Since its establishment in 2003, Youngjae-oh has come up with numerous educational materials and programs for children’s brain deve...","For South Korean parents, education is a top priority for their children and there is often keen interest in nurturing their talent. The Afternoon School for the Gifted, or Youngjae-oh in Korean, is an education center that is a key player in the development of education for the gifted. Since its establishment in 2003, Youngjae-oh has come up with numerous educational materials and programs for children’s brain development, based on its study of the field. The materials developed by Youngjae-oh are popular among mothers and educators. Currently, about 37,000 children learn from the materials developed by Youngjae-oh, which focuses on raising the self-directed learning capabilities of children. One of its most popular programs is the 8Bastket program, which aims to evenly stimulate eight parts of the brain. It helps children learn comprehensively through activities such as line drawing, Hangeul , math, mazes and fairy tales. “Wrong education methods may lead to lopsided thinking. For balanced development, it is important to make progress in all eight parts of the brain,” said Lim Seo-young, the center’s chief. The center stresses the importance of parents recognizing and responding to children who show exceptional abilities or potential. It has been making efforts to communicate with these parents and encourage them. On Sept. 10, Youngjae-oh held a charity event to donate some 270 rice sacks, along with parents, as part of its efforts to engage them. Youngjae-oh will also donate all profits from sales of the first 3,000 copies of its new book -- set to be released early next year -- to Seungil Hope Foundation’s campaign to establish a hospital dedicated to patients of the Lou Gehrig’s disease. The center will further expand its business to promote the education of the gifted and provide parents with the help they need in raising their children, Lim said.","south korean parents education ,korean parents education ,korean parents education is ,education is top priority ,children for south korean","['south korean', 'the Afternoon School for the Gifted', 'Korean']",14,"[ 0.          1.          0.         ... -0.22021902  0.52336067
  0.15011138]",Jo He-rim,Social affairs,12,2016,"korean parents education is top ,for south korean parents education ,south korean parents education ,popular among mothers and educators ,south korean parents education is","['south korean', 'the Afternoon School for the Gifted', 'Korean', 'Lim seo - young', 'Seungil Hope Foundation ’s', 'Lim']",7,"[ 0.          1.          0.         ... -0.22021902  0.52336067
  0.15011138]"
2,2,2,Government delays implementation of state-authored history textbooks to 2018,"The South Korean government said Tuesday it will postpone the implementation of the controversial state-authored history textbooks by one year to 2018 amid growing demand to nullify the publication.Withdrawing its original plan to implement the textbooks next year, the Ministry of Education said it will adopt the textbooks the following year. Schools will be given the right to choose from among the new textbook and o...","The South Korean government said Tuesday it will postpone the implementation of the controversial state-authored history textbooks by one year to 2018 amid growing demand to nullify the publication.Withdrawing its original plan to implement the textbooks next year, the Ministry of Education said it will adopt the textbooks the following year. Schools will be given the right to choose from among the new textbook and other private textbooks issued under the current system.""We will secure autonomy, diversity and improve the overall quality of the textbooks by letting schools choose between the approved private textbooks and the state-authored textbooks starting in 2018,"" Education Minister Lee Joon-sik said at a press briefing held at the government complex in Sejong, 121 kilometers south of Seoul.During a month-long opinion gathering period that ended on Friday, the ministry received a total of 3,807 opinions, with 1,630 related to the content and 67 to typos.The ministry plans to produce the final version of the textbooks in January. The Park Geun-hye administration has pushed for the state-issued textbooks to fix what it called predominantly ""left-leaning"" content in existing private publications and to forge a ""common understanding"" of history. Opponents said the government should not dictate the way history is written and taught. Calls for the book's cancellation swelled especially after Park was impeached on Dec. 9 over a massive political scandal.","the textbooks next year ,history textbooks to 2018 ,korean government said tuesday ,textbooks next year ,textbooks next year the","['south korean', 'the Ministry of Education']",14,"[ 0.          1.          0.         ... -0.22691052  1.0088917
  0.01525681]",KH디지털2,Education,12,2016,"textbooks starting in 2018 education ,textbooks next year the ministry ,south korean government said tuesday ,implement the textbooks next year ,authored textbooks starting in 2018","['south korean', 'the Ministry of Education', 'Lee Joon - sik', 'Sejong', 'Seoul']",8,"[ 0.          1.          0.         ... -0.22691052  1.0088917
  0.01525681]"
3,3,3,Attocube to enter Mongolian preschool education market,Attocube announced on Dec. 19 that it recently signed a memorandum of understanding with the Mongolian Association of Private Pre-school Center concerning its entrance into Mongolia’s preschool education market. Attocube is a startup company that develops diverse types of educational content using wooden blocks as well as IT-based smart toys.  Attocube CEO Sangtaek Han (right) and Executive Director Battuya Banzar ...,"Attocube announced on Dec. 19 that it recently signed a memorandum of understanding with the Mongolian Association of Private Pre-school Center concerning its entrance into Mongolia’s preschool education market. Attocube is a startup company that develops diverse types of educational content using wooden blocks as well as IT-based smart toys.  Attocube CEO Sangtaek Han  and Executive Director Battuya Banzar of the Mongolian Association of Private Pre-school Center recently signed an MOU on the company’s entry into the Mongolian infant/toddler market. Based on the memorandum, Attocube will export approximately 1,000 sets of wooden blocks and related educational content. The company joined the economic mission sent to Mongolia in July, where it held a meeting with the Mongolian Association of Private Pre-school Center. This quickly led to local tests of educational toys and export negotiations. An Attocube spokesperson said, “One of the member kindergartens of the association is already conducting pilot classes based on our wooden blocks and workbooks.”In addition to its wooden cubes, Attocube’s educational content consists of workbooks, picture books, role-playing books, and board games. Children arrange the wooden blocks into the configurations outlined in the workbook, which are then used to create stories or engage in role-playing activities. The blocks can also be used in conjunction with board games or textbooks to promote creative thinking.To accompany its offline products, Attocube will be releasing online/offline products that can be linked to a smartphone within the first quarter of 2017. These products will involve arranging wooden blocks to re-create shapes that appear on the smart device’s screen.Attocube’s products have proven effective in promoting multi-sensory learning for children three to four years of age by stimulating the senses of sight, touch, and hearing and engaging critical thinking skills. An Attocube spokesperson said, “Through the memorandum, we now have an opportunity to establish a significant presence in the Mongolian education market, where interest in preschool education is very high. And we will continue expanding our presence in key strategic markets overseas.” Attocube receives support, including assistance with marketing, from the Gyeonggi Center for Creative Economy & Innovation in its efforts to enter foreign markets.","to enter mongolian preschool ,mongolian preschool education market ,enter mongolian preschool education ,entrance into mongolia preschool ,into mongolia preschool education","['the Mongolian Association of Private Pre - school Center', 'Sangtaek Han', 'Battuya Banzar']",14,"[ 0.          0.          0.         ... -0.42523518  0.17641051
  0.24912915]",Lim Jeong-yeo,Education,12,2016,"entrance into mongolia preschool education ,education market attocube is startup ,mongolia preschool education market attocube ,into mongolia preschool education market ,its entrance into mongolia preschool","['the Mongolian Association of Private Pre - school Center', 'Sangtaek Han', 'Battuya Banzar', 'the Mongolian Association of Private Pre - school Center', 'MOU', 'mongolian', 'the Mongolian Association of Private Pre - school Center', 'mongolian', 'the Gyeonggi Center for Creative Economy & Innovation']",8,"[ 0.          0.          0.         ... -0.42523518  0.17641051
  0.24912915]"
4,4,4,Teen runaways find hope at shelters,"For Kim Young-eun, 18, running away from her home in the summer of 2015 was an act of rebellion against her stepfather, who she said kept trying to take away her freedom.　“I had a bad relationship with my stepfather because he always nagged me to stop using my cellphone,” Kim told The Korea Herald during an interview at Geumcheon Youth Center in southwestern Seoul, a shelter for female teen runaways.  　She descr...","For Kim Young-eun, 18, running away from her home in the summer of 2015 was an act of rebellion against her stepfather, who she said kept trying to take away her freedom.“I had a bad relationship with my stepfather because he always nagged me to stop using my cellphone,” Kim told The Korea Herald during an interview at Geumcheon Youth Center in southwestern Seoul, a shelter for female teen runaways.  She described her leaving home as a spur-of-the-moment decision. “One day, he took away my phone while I was contacting a friend. I was pissed off, left home and traveled up to Seoul with a friend,” she said, whose biological parents divorced when she was 8 years old. Having grown up in a small city in North Gyeongsang Province, Kim and her friend had no money, no one to turn to and nowhere to stay in Seoul. She ended up living on the streets. Stock image“I spent nights wandering around the city or killing time at internet cafes. We did not have money so we often skipped meals,” she said. After two months of the rough life on the streets, she sought refuge at the Geumcheon center. “I could not stand life on the streets any longer,” said Kim, who recently returned to her family after a one-year stay at the shelter. “It was fun to participate in various activities. I even learned to play musical instruments, make coffee and bake bread.” There are 119 such shelters across the country, funded by the Ministry of Gender and Family and local municipalities. They provide vulnerable teenagers with accommodation, food and counseling services for up to three years. Designed to help them safely return home and lead law-abiding lives, the centers also offer the juveniles job training, education on how to quit smoking and have safe sex as well as opportunities to participate in cultural activities, such as watching movies or theatrical performances.In the first half of this year, 14,221 teenagers stayed at state-run shelters. Last year, the facilities housed 25,012 youngsters.“One of the major reasons for kids to run away from home is family dissolution. Especially in the process of parents getting divorced and shifting responsibility for raising children, their kids grow mentally unstable and end up running away from home,” said Choi Eun-young, a head counselor at the Geumcheon center. Police data put the number of teen runaways at 11,383 as of June 2016. But, the actual number might be higher than reported, she added.“As teen runaways are desperate to get money, feed themselves and belong somewhere, they often put up with being exploited and underpaid,” she said. “They are often lured into crimes, such as theft or sex trade.”Many of the teenagers who left home choose to live in a “runaway family,” the term they use to describe a group of runaways who meet in internet chat rooms and develop relationships based on committing crimes together.Girls are more vulnerable, Cho went on, as they are often forced into selling sex. According to a survey of 92 runaway teen girls in Daejeon, 38 percent said they had worked as prostitutes. About half, or 48.6 percent, of them said they started at ages 14-16. Asked who had brokered the sex, 31.4 percent said an older or younger acquaintance, followed by friends at 31 percent and themselves at 17.1 percent.Yang Ye-seul, 16, who is set to return home at the end of this year, was one of the girls who turned to prostitution while living on the streets.“I ran away because of my stepfather. I stayed in my friend’s house in Seoul after I left home,” she said, with her eyes fixed on her phone. Yang, whose biological parents are also divorced, was caught selling sex to adults and received probation from the court. Yang came to the shelter because the court determined her parents were not able to protect her. “My life here has been okay. The relationship with my family got better.”“In most cases, it is not children’s fault that they run away. Most of the children end up on the streets because they are neglected at home and school,” said the counsellor Choi. “What runaway children need is continued care, love and trust from society.”“The government should help parents to fix their relationships with their runaway kids and not to give up on them,” she said. “Parents need to change too -- as much as their misbehaving children.”Former runaway Kim was recently accepted into a university in her hometown and will begin to study social welfare in March.“I am so happy. I feel rewarded. My father is proud of me. My only wish was to live like an ordinary person, like a salaried worker,” she said. “Having gone through all this, I want to become a social worker and help other children not to be like me.”By Ock Hyun-ju","teen runaways she descr ,female teen runaways she ,female teen runaways ,for female teen runaways ,teen runaways she","['Kim Young - eun', 'Kim', 'the Korea Herald', 'Seoul']",14,"[ 0.          0.          0.         ... -0.58558559  0.18333358
  0.40055901]",Korea Herald,Social affairs,12,2016,"misbehaving children former runaway kim ,female teen runaways she described ,runaway teen girls in daejeon ,shelter for female teen runaways ,female teen runaways she","['Kim Young - eun', 'Kim', 'the Korea Herald', 'Seoul', 'Seoul', 'North Gyeongsang Province', 'Kim', 'Seoul', 'Kim', 'the Ministry of Gender and Family', 'Choi Eun - young', 'Cho', 'Daejeon', 'Yang Ye - seul', 'Seoul', 'Yang', 'Yang', 'Choi', 'Kim', 'Ock Hyun - ju']",6,"[ 0.          0.          0.         ... -0.58558559  0.18333358
  0.40055901]"
5,5,5,Chinese-Koreans think living standards in S. Korea better than in China: poll,"Chinese-Koreans residing in South Korea think their living standards here are better than they were in China, a local poll showed Sunday.The findings by the IOM Migration Research and Training Center revealed that of the 2,017 people checked from July to October,52.9 percent said life in South Korea is better than in China. The people checked covers Chinese nationals who are ethnically Korean.The survey also showed t...","Chinese-Koreans residing in South Korea think their living standards here are better than they were in China, a local poll showed Sunday.The findings by the IOM Migration Research and Training Center revealed that of the 2,017 people checked from July to October,52.9 percent said life in South Korea is better than in China. The people checked covers Chinese nationals who are ethnically Korean.The survey also showed that 27 percent of ethnic Koreans with ties to China said there was no particular difference in living standards between the two countries, while 20.1 percent said life in China was actually better.The latest report showed 26.6 percent of Chinese-Koreans were engaged in sales and service sector jobs, with those holding daily positions accounting for 23.7 percent of the total. Of the Chinese-Koreans in the country, 8 percent were students, 7.5 percent were office workers or held technical posts at work, and 5.9 percent were self-employed.The training center's poll then revealed that 28.9 percent of the respondents said they had no trouble getting used to life in South Korea, with 18.8 percent professing some trouble in adopting to the different environment and culture. Of those checked, 14.4 percent said they had difficulty finding work here and 11.6 percent said there were some language issues.The center said that South Korea needs to take steps to improve the legal status of Chinese-Koreans and do more to help their children improve their Korean language skills.","chinese koreans think living ,in korea better than ,china poll chinese koreans ,better than in china ,standards in korea better","['Chinese', 'South Korea', 'China', 'the IOM Migration Research and Training Center', 'South Korea', 'China', 'chinese', 'korean']",14,"[ 0.          0.          0.         ... -0.60788405  0.46986744
  0.01792756]",임정요,Social affairs,12,2016,"their children improve their korean ,26 percent of chinese koreans ,korean the survey also showed ,27 percent of ethnic koreans ,percent of chinese koreans were","['Chinese', 'South Korea', 'China', 'the IOM Migration Research and Training Center', 'South Korea', 'China', 'chinese', 'korean', 'Koreans', 'China', 'China', 'Chinese - Koreans', 'Chinese', 'South Korea', 'South Korea', 'Chinese - Koreans', 'korean']",5,"[ 0.          0.          0.         ... -0.60788405  0.46986744
  0.01792756]"
