,Unnamed: 0,Unnamed: 0.1,title,description,body,keyword,ne,cluster,vector,author,section,month,year,keyword_e,ne_e,cluster_e,vecctor_e
91,91,91,Korean-Americans have most unfavorable views of Trump: survey,"Korean-Americans have the most unfavorable view of Republican presidential candidate Donald Trump among Asian-American voters in the U.S., a survey showed Tuesday.About 80 percent of Korean-Americans had negative views of Trump, followed by Japanese-Americans with 76 percent and Filipino-Americans with 62 percent, according to the survey of 1,212 Asian-American voters released by Asian Americans Advancing Justice.In ...","Korean-Americans have the most unfavorable view of Republican presidential candidate Donald Trump among Asian-American voters in the U.S., a survey showed Tuesday.About 80 percent of Korean-Americans had negative views of Trump, followed by Japanese-Americans with 76 percent and Filipino-Americans with 62 percent, according to the survey of 1,212 Asian-American voters released by Asian Americans Advancing Justice.In total, 61 percent of the respondents had unfavorable views of Trump while only 19 percent had favorable views.The results are attributable to a series of statements by Trump that showed that the real-estate tycoon has deeply negative views of U.S. security commitments overseas. Trump has argued that the U.S. should be prepared to end protection of allies unless they pay more. He even suggested allowing South Korea and Japan to develop their own nuclear weapons for self-defense so as to reduce U.S. security burdens.The survey also showed that a majority of Asian-Americans have favorable views of Democratic candidate Hillary Clinton.Japanese- and Vietnamese-Americans had the most favorable views of Clinton with 66 percent each, followed by Asian Indian-Americans with 63 percent, Chinese-Americans with 61 percent and Korean-Americans with 60 percent, the survey showed.Overall, 62 percent of Asian-Americans had favorable views of Clinton, it showed.","trump survey korean americans ,donald trump among asian ,negative views of trump ,presidential candidate donald trump ,trump followed by japanese","['korean', 'republican', 'Donald Trump', 'asian', 'U.S.', 'Korean - Americans', 'Trump', 'Japanese - Americans', 'Filipino - Americans', 'asian', 'Asian Americans']",14,"[ 0.          0.          0.         ... -0.53633726  1.04544234
  0.31308943]",임정요,International,5,2016,"candidate donald trump among asian ,trump among asian american voters ,republican presidential candidate donald trump ,presidential candidate donald trump among ,negative views of trump followed","['korean', 'republican', 'Donald Trump', 'asian', 'U.S.', 'Korean - Americans', 'Trump', 'Japanese - Americans', 'Filipino - Americans', 'asian', 'Asian Americans', 'Trump', 'Trump', 'U.S.', 'U.S.', 'South Korea', 'Japan', 'U.S.', 'Asian - Americans', 'democratic', 'Hillary Clinton', 'Vietnamese - Americans', 'Clinton', 'Asian Indian - Americans', 'Chinese - Americans', 'Korean - Americans', 'Asian - Americans', 'Clinton']",7,"[ 0.          0.          0.         ... -0.53633726  1.04544234
  0.31308943]"
92,92,92,Nearly 60% of children supporting parents financially: survey,"Nearly 6 out of 10 South Koreans are supporting their parents financially, but people's thinking about bearing responsibility for aging parents has changed considerably over the past decade, as they demand more from society and less from children, a recent survey showed Tuesday.The survey, conducted by the Korea Institute for Health and Social Affairs, canvassed 1,000 people aged 20-64 by telephone between August and...","Nearly 6 out of 10 South Koreans are supporting their parents financially, but people's thinking about bearing responsibility for aging parents has changed considerably over the past decade, as they demand more from society and less from children, a recent survey showed Tuesday.The survey, conducted by the Korea Institute for Health and Social Affairs, canvassed 1,000 people aged 20-64 by telephone between August and September last year. Responses were drawn from those with at least one of their parents or parents-in-law living.Results said 56.7 percent were economically assisting the parents, the responsibility lying heavier on older children of the family, but the amount of supportive money being larger among younger offspring.For children in their 20s, 18.3 percent said they were helping their parents financially. The number was 52.8 percent for those in their 30s, 71.1 percent for 40s, 79.3 percent for 50s and 71 percent for 60s.  The average amount of support was 348,000 won  a month. The amount decreased with age: Those in their 20s gave an average of 435,000 won compared with those in their 60s who provided 150,000 won a month.  Eldest sons on average bore the largest amount, 476,000 won, compared with the 339,000 won for younger sons. The situation was the same for daughters, with the oldest ones providing 287,000 won and the younger ones 266,000 won.Financial support for parents accounted for an average 9.7 percent of children's income, the survey said.The institute also polled public opinion on support for parents and found that while 89.9 percent of the people in 1998 believed the family is responsible for taking care of them, only 31.7 percent felt that way in 2014. Instead, 51.7 percent said society should take care of parents, compared with 2 percent in 1998.The traditional notion of responsibility of the eldest son has also weakened. In 1998, 22.4 percent said eldest sons should be responsible for supporting their parents. In 2014, it fell to 2 percent. Compared with the 7 percent in 1998 who said all sons are responsible, in 2014, only 1.1 percent said so. Comparatively, 24.1 percent in the latter year said all children are equally responsible, up from 15 percent in 1998.In an analysis of the findings, the institute said the long-held notion of the family taking care of the parents is changing as childbirths fall and women join the workforce, placing more responsibility on society.""We need to expand on a public care system in which the state handles the financial support, while the family provides emotional care,"" the institute said. ""We also need to work on improving job availability for the elderly and social safety networks, and help financial aspects of aging parents through programs preparing them for the later years of their lives.""","parents financially survey nearly ,recent survey showed tuesday ,parents financially survey ,of 10 south koreans ,supporting parents financially survey","['South Koreans', 'the Korea Institute for Health and Social Affairs']",14,"[ 0.          0.          0.         ... -0.24400948  0.50546223
  0.2988404 ]",임정요,Social affairs,5,2016,"financial aspects of aging parents ,children recent survey showed tuesday ,koreans are supporting their parents ,their parents financially the number ,000 won for younger sons","['South Koreans', 'the Korea Institute for Health and Social Affairs']",4,"[ 0.          0.          0.         ... -0.24400948  0.50546223
  0.2988404 ]"
93,93,93,"In Iran, booming Korean culture leads many youngsters to study the language","It was a rainy afternoon, but a small classroom at a South Korea-sponsored Korean language school in Tehran was packed with 15 young people eager to learn a foreign tongue.The students were good enough to complete a few simple sentences although they were in the beginner's class.They looked quite serious while practicing conversation in Korean in pairs, such as, ""How did you get to the King Sejong Institute?"" ""I came...","It was a rainy afternoon, but a small classroom at a South Korea-sponsored Korean language school in Tehran was packed with 15 young people eager to learn a foreign tongue.The students were good enough to complete a few simple sentences although they were in the beginner's class.They looked quite serious while practicing conversation in Korean in pairs, such as, ""How did you get to the King Sejong Institute?"" ""I came by taxi.""The King Sejong Institute opened two years ago with 52 students in three classes, and it now has 116 students in eight classes. It runs the classes for 2 1/2 hours, three days a week, at a school for Koreans in Tehran. This is proof of the growing interest among Iranians toward the Korean language although exchanges between the countries have been restricted due to the international sanctions imposed on Iran.""It'd be better if a student could finish all five courses in a row. Unfortunately, however, we're unable to do so because there are so many on the waiting list,"" said Choi Yeon-suk, chief of the institute, on Wednesday.Choi says a considerable number of the applicants already have experience learning Korean by themselves. About 90 percent of them were women whose interest in Korean TV dramas and K-pop music has spilled over into Korea and its language.Some of them are dreaming of landing a job or going to South Korea to further their studies, according to Choi.""I'm learning Korean with a plan to study at a Korean university,"" a student said. ""I practice Korean and its writing system by watching 'Descendants of the Sun' these days.""Broadcast simultaneously in South Korea and China from Feb. 24 through April 14, the military-romance drama became a sensation in both countries, as well as other Asian nations.Demand for learning Korean has soared recently with the lifting of the sanctions on Iran.As Korean firms rush to grab business opportunities in the new market, the demand for manpower who can speak both Persian and Korean fluently is ever rising, the head of the language institute said.Iranian college students attending the King Sejong Institute, in particular, are considered assets to Korean firms because in many cases they also have good English skills.""Iranian people favor Korean companies because they have a favorable impression of the country,"" she said. ""The number of applicants also grows with the older generations as they want to get a chance to work for Korean firms.""","iran booming korean culture ,classroom at south korea ,practicing conversation in korean ,in iran booming korean ,iran booming korean","['South Korea', 'korean', 'Tehran', 'Korean', 'the King Sejong Institute']",14,"[ 0.          0.          0.         ... -0.7080065   0.50279582
 -0.08911869]",임정요,International,5,2016,"week at school for koreans ,korean language school in tehran ,university student said practice korean ,52 students in three classes ,small classroom at south korea","['South Korea', 'korean', 'Tehran', 'Korean', 'the King Sejong Institute', '""The King Sejong Institute', 'Koreans', 'Tehran', 'Iranians', 'korean', 'Iran', 'Choi Yeon - suk', 'Choi', 'Korean', 'korean', 'Korea', 'South Korea', 'Choi', 'Korean', 'korean', 'korean', 'South Korea', 'China', 'asian', 'Korean', 'Iran', 'korean', 'persian', 'korean', 'iranian', 'the King Sejong Institute', 'korean', 'korean', 'korean']",8,"[ 0.          0.          0.         ... -0.7080065   0.50279582
 -0.08911869]"
94,94,94,Korean parents spend W130m to pay for child’s wedding,"South Korean parents spend an average of 130 million won ($111,618) on their children’s marriages, using more than half of their retirement savings, a report showed Thursday.According to the survey by Samsung Life Retirement Research Center on 1,501 parents with an average of 2.2 children, they spent 125.1 million won in marriage expenses.The amount was double for those with sons who spend on average of 94 million w...","South Korean parents spend an average of 130 million won  on their children’s marriages, using more than half of their retirement savings, a report showed Thursday.According to the survey by Samsung Life Retirement Research Center on 1,501 parents with an average of 2.2 children, they spent 125.1 million won in marriage expenses.The amount was double for those with sons who spend on average of 94 million won, while it was 42 million for daughters.Most, or 93 percent, used their savings, while 11 percent also utilized their severance pay, canceled their private pensions or insurance  or sold their houses . Multiple answers were allowed. Marriage expenses in Korea usually include money for housing and other fixtures for the newlyweds, wedding ceremony, honeymoon and various gifts for the in-laws.123rfNearly 12 percent also said they took out a loan to pay for the wedding. Some 23 percent of the surveyed parents whose children were not yet married also said they were willing to get a loan to support their children.Such spending accounted for 55 percent of the retirement funds the parents had accumulated, the report said. Some 75 percent of the parents whose children are all married said the cost of supporting the weddings put a strain on their retirement life.The report also showed that parents were more conservative toward the concept and method of marriage and weddings. Among the parents, 67 percent viewed it as a “marriage of the two families,” and 71 percent said their children getting married was a task for the parents to accomplish.While 56 percent of the parents said they accepted their responsibility of supporting the wedding, only 28 percent of the children agreed.Some 30 percent of the parents also believed that the newlywed’s house must be provided by the groom and furniture by the bride, as is customarily done in Korea. Only 14 percent of the children said they wanted to stick to such traditions.While 30 percent of the parents also thought that gifts for the in-laws should be of a certain quality, only 16 percent of the children saw it as necessary.“As parents in their 50s and 60s at present are expected to have two or threefold longer years of their retirement  from the past, they should be more cautious in planning their support for the weddings of their children,” the report said.","korean parents spend w130m ,parents spend w130m to ,million won in marriage ,parents spend w130m ,wedding south korean parents","['south korean', 'Samsung Life Retirement Research Center']",14,"[ 0.          1.          0.         ... -0.62822187  0.46022192
  0.01372152]",Korea Herald,Social affairs,5,2016,"million won in marriage expenses ,children they spent 125 million ,125 million won in marriage ,42 million for daughters most ,130 million won on their","['south korean', 'Samsung Life Retirement Research Center', 'Korea', 'Korea']",7,"[ 0.          1.          0.         ... -0.62822187  0.46022192
  0.01372152]"
95,95,95,"Report says women leaving workforce for family, from lack of quality jobs","More than 90 percent of South Korean women in their latter 30s, now economically inactive, had been previously employed, a report said Thursday, a finding that supports arguments that they are leaving the workforce to care for child and family.According to the report from the Korea Employment Information Service, out of 836,000 women in the 35-39 age group who were not working, 93.8 percent, or 785,000, formerly held...","More than 90 percent of South Korean women in their latter 30s, now economically inactive, had been previously employed, a report said Thursday, a finding that supports arguments that they are leaving the workforce to care for child and family.According to the report from the Korea Employment Information Service, out of 836,000 women in the 35-39 age group who were not working, 93.8 percent, or 785,000, formerly held jobs.Fifty-seven percent of the women who previously had worked were raising children, and 36.3 percent were full-time housewives, the report said.The pattern was the same for highly educated women, other findings indicated. While the employment rate of women with degrees from vocational colleges or higher measured 62.7 percent in 2015, almost the same as the year before, the rate for those in their late 30s dropped from 56.7 percent to 56.4 percent.The increase in the number of economically inactive population among the highly educated was more marked in the late-30s group, rising 20,000 to 503,000 last year. This made the late-30s the most non-employed segment among all age groups of women. Park Jin-hee, who authored the report, said while the country's economic downturn likely had its toll on the job market for women, the lack of quality in the jobs available compounded the problem.The report cited 10.1 percent of educated women in their 30s who said they voluntarily abandoned their career because the demanded work hours and the level of pay did not satisfy them. This was an increase from 8.9 percent in 2014.""The availability of jobs that are stable and have flexible hours and unemployment insurance has stagnated in 2014 and 2015,"" Park said.  ""We have to induce these women to choose at least to work part-time rather than end their careers by creating good quality jobs.""","women leaving workforce for ,of 836 000 women ,south korean women ,women leaving workforce ,says women leaving workforce","['south korean', 'the Korea Employment Information Service']",14,"[ 0.          1.          0.         ... -0.72189808  0.15382464
  0.14844477]",임정요,Social affairs,5,2016,"10 percent of educated women ,percent of south korean women ,30s dropped from 56 percent ,educated women in their 30s ,out of 836 000 women","['south korean', 'the Korea Employment Information Service', 'Park Jin - hee', 'Park']",5,"[ 0.          1.          0.         ... -0.72189808  0.15382464
  0.14844477]"
96,96,96,Rising immigration pushes S. Korea toward diversity,"With every passing year and a steady influx of foreigners chasing the ""Korean dream,"" the number of people born abroad and those from multicultural families will grow and this change will invariably nudge South Korea to become a more diverse society, local observers said Tuesday.As of March, 1.94 million foreigners were living in South Korea, an increase of more than four-fold compared to 2000, data by the Ministry o...","With every passing year and a steady influx of foreigners chasing the ""Korean dream,"" the number of people born abroad and those from multicultural families will grow and this change will invariably nudge South Korea to become a more diverse society, local observers said Tuesday.As of March, 1.94 million foreigners were living in South Korea, an increase of more than four-fold compared to 2000, data by the Ministry of Justice showed. The greatest jump was seen among long-term residents who accounted for about 75 percent of all foreigners, up 30 percentage points from 2002. At this pace the country will soon have more than 2 million foreigners.International marriages and employment of foreign workers have been the driving force behind the growth. Last year, 305,000 foreigners were living on a spousal visa in South Korea, a figure that only took five years to jump two-fold. South Korea first started encouraging single men in the country to marry foreign women in the 1990s to prop up the nation's agricultural industry, and as a result, the number of such unions quadrupled between 2000 and 2005. The trend came to a screeching halt in 2011, as the justice ministry tightened regulations for South Koreans trying to marry foreigners as part of efforts to crack down on immigration fraud and domestic violence in these households.Employment of foreigners, however, has risen consistently in recent years. There were 938,000 foreign workers in South Korea as of May 2015, up 20 percent from 2012, which is the year when the data was first collected.South Korean companies started hiring immigrants in the 1980s to secure a steady supply of workers in emerging industries. The government became involved in 1993, launching a program training immigrants for South Korean firms, and nearly 160,000 people graduated from this scheme by 2002. Two years later, South Korea announced stricter regulations for employers, requiring them to ensure equal rights for local and foreign employees alike.Due to South Korea's geographic proximity to China, ethnic Koreans from the world's most populous country make up 1 in 3 foreigners here, or 630,000 people. More Chinese people of Korean descent have settled in South Korea since the peninsular country instituted a legal basis for their employment here in 1999.It became even easier for them to enter South Korea in 2007 when Seoul created a Working Visit  visa for ethic Koreans, including those who do not have family ties in South Korea.The worldwide boom of Korean pop culture, known here as ""Hallyu,"" has also brought in an increasing number of foreign students studying in South Korea. Between 2011 and March this year, they increased 20 percent to 106,138, according to the justice ministry.A string of foreigners have become household names in a variety of fields in South Korea. In the 90s, naturalized South Korean lawyer Robert Holley and Ida Daussy from France became popular TV personalities. Lee Charm, a German-born entrepreneur, became the highest ranking foreign official in South Korea by heading of Korea Tourism Organization in 2009. Jasmine Lee from the Philippines became the first foreign-born lawmaker in South Korea after securing a seat as a proportional representative for the ruling Saenuri Party in 2012.As long-term residents grow, households consisting of one or more of them have naturally increased as well. About 1.3 percent, or 278,036, of all households in South Korea were ""multicultural"" in 2015, according to the Ministry of Gender Equality and Family.Considering the average South Korean household consists of 3.16 people, that means some 880,000 people were part of a multicultural family last year. The same data also showed that the number of multicultural family members jumped more than three-fold between 2006 and 2015. As South Korean families diversify, the government has been forced to shift its multicultural policy from assisting the families' adjustment to helping them find jobs and get educated.Challenges still remain for foreigners living in South Korea. Government policy has centered on foreign spouses even though the profile of a foreigner in the country has become much more diverse.Government programs sometimes overlap from ministry to ministry.Some South Koreans are still reluctant to accept foreigners as part of their community, as a World Values Survey ranked South Korea at 51st out of 59 countries in terms of racial awareness. Some 44 percent of South Koreans felt negative toward foreign workers and immigrants in the same survey, which was the fourth highest ratio among all countries studied.Researcher Oh Jung-eun at the International Organization of Migration Research & Training Center stressed that South Koreans must start learning to view foreigners as equals to them rather than objects for sympathy.""To realize true social integration, South Korea should set policies that allow immigrants to do their part in society and provide them with proper education,"" she said.","rising immigration pushes korea ,immigration pushes korea toward ,immigration pushes korea ,march 94 million foreigners ,rising immigration pushes","['korean', 'South Korea', 'South Korea']",14,"[ 0.          0.          0.         ... -0.19500481  0.54207373
  0.04744771]",이현정,Social affairs,5,2016,"worldwide boom of korean pop ,as south korean families diversify ,south korea the worldwide boom ,south korean families diversify the ,south korean families diversify","['korean', 'South Korea', 'South Korea', 'the Ministry of Justice', 'South Korea', 'South Korea', 'South Koreans', 'South Korea', 'south korean', 'south korean', 'South Korea', ""South Korea 's"", 'China', 'Koreans', 'chinese', 'korean', 'South Korea', 'South Korea', 'Seoul', 'Working Visit', 'Koreans', 'South Korea', 'korean', 'Hallyu', 'South Korea', 'South Korea', 'south korean', 'Robert Holley', 'Ida Daussy', 'France', 'Lee Charm', 'German', 'South Korea', 'Korea Tourism Organization', 'Jasmine Lee', 'Philippines', 'South Korea', 'Saenuri Party', 'South Korea', 'the Ministry of Gender Equality and Family', 'south korean', 'south korean', 'South Korea', 'South Koreans', 'World Values Survey', 'South Korea', 'South Koreans', 'the International Organization of Migration Research & Training Center', 'South Koreans', 'South Korea']",3,"[ 0.          0.          0.         ... -0.19500481  0.54207373
  0.04744771]"
