,Unnamed: 0,Unnamed: 0.1,title,description,body,keyword,ne,cluster,vector,author,section,month,year,keyword_e,ne_e,cluster_e,vecctor_e
131,131,131,Most South Korean office workers stressed about English,"Most South Korean office workers are stressed about being proficient in English regardless of whether their work requires use of the language, a survey showed Thursday.Of 713 surveyed workers, 86.1 percent said they are stressed about English while working, said Hunet, an online education service.While some 38.7 percent said their stress level could be rated as “average,” nearly half, or 45.6 percent, said they wer...","Most South Korean office workers are stressed about being proficient in English regardless of whether their work requires use of the language, a survey showed Thursday.Of 713 surveyed workers, 86.1 percent said they are stressed about English while working, said Hunet, an online education service.While some 38.7 percent said their stress level could be rated as “average,” nearly half, or 45.6 percent, said they were “quite stressed” or “very stressed.” Only 2.5 percent said they felt no pressure.123rfThey answered that they felt most stressed when required to write emails or converse in English. Some  said they felt stressed when their line of work was restricted due to their English ability, or when watching their coworkers get promoted or recruited due to their good command of English .The actual use of English while working, however, was not as common, with 62 percent saying they sometimes or almost never used English at work.Nonetheless, 75.4 percent said English was very or somewhat important. Almost all or 94 percent said they plan to study English more.Most of the respondents paid less than 50,000 won  to study English a month on average, while 10.9 percent said they spent more than 100,000 and less than 150,000 won a month. English was placed as the priority second language, identified as being important by 87.7 percent of respondents, followed by Chinese , Japanese  and Spanish . Multiple choices were allowed.","english most south korean ,korean office workers stressed ,workers stressed about english ,office workers are stressed ,most south korean office","['south korean', 'Hunet']",14,"[ 0.          1.          0.         ... -0.33114102  0.4858529
  0.4085061 ]",Korea Herald,Social affairs,3,2016,"korean office workers are stressed ,most south korean office workers ,thursday of 713 surveyed workers ,office workers are stressed about ,000 won to study english","['south korean', 'Hunet', 'chinese', 'japanese', 'Spanish']",8,"[ 0.          1.          0.         ... -0.33114102  0.4858529
  0.4085061 ]"
132,132,132,South Korea steps up fight against TB,"South Korean health authorities said Thursday all Koreans are now required to be tested for latent tuberculosis at least twice in their lives, at ages 15 and 40, as a part of measures to drop the high prevalence rate of the infectious disease in the country.  According to the World Health Organization, over 95 percent of TB cases and deaths occur in developing countries. South Korea, the fourth-largest economy in As...","South Korean health authorities said Thursday all Koreans are now required to be tested for latent tuberculosis at least twice in their lives, at ages 15 and 40, as a part of measures to drop the high prevalence rate of the infectious disease in the country.  According to the World Health Organization, over 95 percent of TB cases and deaths occur in developing countries. South Korea, the fourth-largest economy in Asia, has the highest incidence rate of TB among members of the Organization for Economic Cooperation and Development, partly due to the lack of epidemiological research of the disease since the Korean War .Health Minister Chung Chin-youb speaks at a press conference Thursday. “We estimate that some 400 Koreans have been infected with TB since after the Korean War,” said Health Minister Chung Chin-youb at a press meeting in Seoul. “Although state-run health centers performed epidemiological research very thoroughly after the war, things became different after we introduced our national health insurance system in 1989. When the new system took effect, many state-run health centers were replaced by private clinics that focused on treatments rather than epidemiological research on infectious diseases.”The Health Ministry aims to drop the prevalence rate of the disease to 12 patients per 100,000 people, which is the OECD average. In 2014, South Korea marked a TB incidence rate of 86 patients per 100,000, seven times higher than the average rate of the developed nations.The newly introduced measure requires all Koreans to get tested for latent TB -- a condition in which the TB bacteria is in the body but inactive and causing no symptoms -- at least twice in their lives. The first test should be taken at age 15, with the second at 40. Without treatment, about 5 to 10 percent of latent TB patients are known to develop TB some time in their lives.Participants to a special event promoting prevention of tuberculosis perform a special dance asking the public to cover their coughs to prevent the spread of the infectious disease in central Seoul, Thursday. “With proper treatment, latent TB patients can avoid developing TB by up to 90 percent,” said Minister Chung. According to the Korea Centers for Disease Control and Prevention, no developed nation currently requires all citizens to be tested for latent TB. However, Japan and the U.S. made it mandatory for young children to be tested for the disease from 1965-2002, and 1960-1990, respectively. “Japan also struggled with TB after World War II,” Kwon Joon-wook, who heads the Health Ministry’s bureau of public health policy, told The Korea Herald. “The number of newly diagnosed latent TB patients decreased significantly throughout 1965-2002, after requiring all children to get tested twice, at age 7 and 13.”South Korea has recently seen a number of TB cases occurring at facilities with a large number of people, such as schools and postpartum centers. Last year, TB cases were reported in 974 schools, 332 military bases and 91 day care centers and postpartum care facilities. While the number of newly diagnosed TB patients here last year was the lowest in 15 years, new TB patients between 10 and 14 years old increased over the same period. “South Korea is cornered by countries where the incidence of drug-resistant isolates is the highest in the world: India, China, Russia and North Korea,” said Dr. Vincent Delorme from the Seoul-based Institut Pasteur Korea. “With the increase in tourism and ease of travel, combined with the fact that TB is an extremely contagious disease, it is not surprising to see more and more drug-resistant strains circulating in Korea.” The medical researcher also said there is a lack of genomic information regarding TB isolates circulating in South Korea, which makes the epidemiologic studies incomplete.At the same time, Delorme said bacilli has become resistant to more than 10 available TB drugs in South Korea.  This means that only drugs that have been introduced in recent years are now effective, he added. By Claire Lee","said thursday all koreans ,95 percent of tb ,thursday all koreans ,tb south korean health ,thursday all koreans are","['south korean', 'Koreans', 'the World Health Organization', 'TB', 'South Korea']",14,"[ 0.          1.          0.         ... -0.27298155  0.66013718
  0.28270423]",Claire Lee,Social affairs,3,2016,"authorities said thursday all koreans ,disease in central seoul thursday ,15 years new tb patients ,400 koreans have been infected ,10 percent of latent tb","['south korean', 'Koreans', 'the World Health Organization', 'TB', 'South Korea', 'TB', 'the Organization for Economic Cooperation and Development', 'Chung Chin - youb', 'Koreans', 'TB', 'Chung Chin - youb', 'Seoul', 'Health Ministry', 'OECD', 'South Korea', 'TB', 'Koreans', 'TB', 'TB', 'Seoul', 'TB', 'Chung', 'the Korea Centers for Disease Control and Prevention', 'TB', 'Japan', 'U.S.', 'Japan', 'TB', 'Kwon Joon - wook', 'the Health Ministry ’s', 'the Korea Herald', 'TB', 'Korea', 'TB', 'TB', 'TB', 'TB', 'South Korea', 'India', 'China', 'Russia', 'North Korea', 'Vincent Delorme', 'Seoul', 'Institut Pasteur Korea', 'TB', 'Korea', 'TB', 'South Korea', 'South Korea', 'Claire Lee']",4,"[ 0.          1.          0.         ... -0.27298155  0.66013718
  0.28270423]"
133,133,133,"Job insecurity, depression common among single parents","South Korean single parents are vulnerable to depression and job insecurity, and their young children are often left by themselves after school, a government study showed Tuesday. The study, which surveyed a total of 2,552 single-parent households nationwide last year, revealed that 27 percent of the parents said they have no meaningful social support network at all -- not a single person they can speak or rely on --...","South Korean single parents are vulnerable to depression and job insecurity, and their young children are often left by themselves after school, a government study showed Tuesday. The study, which surveyed a total of 2,552 single-parent households nationwide last year, revealed that 27 percent of the parents said they have no meaningful social support network at all -- not a single person they can speak or rely on -- when they face financial difficulties. More than 65 percent of the households consisted of single mothers and their children.The report showed that more than 60 percent of all Korean single parents are in their 40s, while 77 percent of them are divorcees. Also, 60 percent of them never received post-secondary education. More than 40 percent of them were relying on government subsidies and 78 percent never received any child support payments from noncustodial parents.A significant portion of the parents -- more than 30 percent -- said they were in poor health. Also, the proportion of those who were suffering depression was much higher than the national average. Although 20 percent of the parents said they were depressed, only about 6 percent of them sought professional medical help. More than half of them said they simply “endured” the symptoms of the mental condition and 21.9 percent said they found comfort in alcohol. The employment rate of the parents was almost 90 percent, which is much higher than the national average. Yet the study showed that a large number of them had very limited job security and were receiving low wages. Some 36.7 percent of them were in contract positions or working as day laborers. Another 15.3 percent of them had their own businesses or worked for family businesses without being paid. The average monthly income of single-parent households was 1.73 million won , which was significantly lower than the national household average income of 3.9 million won.The largest proportion of the parents were working in the service sector and almost half of them worked more than 10 hours a day. As a result of their parent’s long working hours, many children of single-parent households were left by themselves after school. In addition, almost half of the children never spent time with their noncustodial parents.By Claire Lee","south korean single parents ,single parents south korean ,korean single parents ,parents south korean single ,job insecurity depression",['south korean'],14,"[ 0.          1.          0.         ... -0.69640362  0.13857618
  0.24461482]",Claire Lee,Social affairs,3,2016,"korean single parents are vulnerable ,south korean single parents ,of all korean single parents ,all korean single parents ,school government study showed tuesday","['south korean', 'korean', 'Claire Lee']",7,"[ 0.          1.          0.         ... -0.69640362  0.13857618
  0.24461482]"
134,134,134,7 in 10 women see marriage as burden to career: survey,"The majority of South Korean women view marriage as a hindrance to their careers, in stark contrast to men, a survey showed Monday. According to the poll by recruitment site Saramin on 1,401 married and unmarried workers, 71.8 percent of women said that tying the knot had a harmful impact on their career, while 75.9 percent of men saw marriage as a boost to their working lives. YonhapMost of the female respondents (7...","The majority of South Korean women view marriage as a hindrance to their careers, in stark contrast to men, a survey showed Monday. According to the poll by recruitment site Saramin on 1,401 married and unmarried workers, 71.8 percent of women said that tying the knot had a harmful impact on their career, while 75.9 percent of men saw marriage as a boost to their working lives. YonhapMost of the female respondents  cited housework and child rearing as the major factors, followed by the possibility of career interruption , companies having no consideration for married women  and office culture forcing married women to quit .For male workers, 69.6 percent of them said that marriage helps them perform better at work because it gives them emotional stability. Nearly 68 percent said marriage motivated them to work harder. Additionally, 46.8 percent said they benefit from their wives’ support and 21 percent cited economic stability. Out of 386 married female and male respondents, 23.8 percent said they benefited from being married while working.  Nearly 15 percent of them, however, said that they had been discriminated against due to their marital status. They felt discriminated against when their employers forced them to quit their job, excluded them from promotions, gave them an unreasonable workload and pressured them not to take paid parental leave.  The survey seems to reflect the social atmosphere that pressures women to leave their regular employment when they get married or are expecting a child. According to 2014 data by the Organization for Economic Cooperation and Development, the employment rate for women aged 25-29 was 68.8 percent, 0.6 percentage points lower than men. But the figure significantly drops to 57.7 percent for women aged 30-34 and to 54.9 percent for those aged 35-39. By Ock Hyun-ju","korean women view marriage ,10 women see marriage ,unmarried workers 71 percent ,women view marriage ,south korean women view","['south korean', 'Saramin']",14,"[ 0.          1.          0.         ... -0.58817285  0.49261445
 -0.02039813]",Ock Hyun-ju,Social affairs,3,2016,"office culture forcing married women ,south korean women view marriage ,women view marriage as hindrance ,culture forcing married women ,forcing married women to quit","['south korean', 'Saramin', 'the Organization for Economic Cooperation and Development', 'Ock Hyun - ju']",7,"[ 0.          1.          0.         ... -0.58817285  0.49261445
 -0.02039813]"
135,135,135,"Korean farmers, laborers less tolerant of migrants: survey","South Koreans who work in fishing, farming and construction industries are less tolerant of immigrants than those who belong to other professional fields, a report by the Gender Ministry showed on Monday.Those industries in South Korea currently employ a large number of foreign-born laborers.The research results reflect how South Korea’s working population may feel “threatened” by migrant workers, many of whom are...","South Koreans who work in fishing, farming and construction industries are less tolerant of immigrants than those who belong to other professional fields, a report by the Gender Ministry showed on Monday.Those industries in South Korea currently employ a large number of foreign-born laborers.The research results reflect how South Korea’s working population may feel “threatened” by migrant workers, many of whom are male, said Ahn Sang-soo, a researcher at Korea Women’s Development Institute who led the report. The study surveyed a total of 4,000 South Koreans aged 19-74 nationwide last year. It asked them to rate their agreement on a scale of 1 to 6 – with 1 being the lowest – toward 22 statements on multiculturalism, national identity and ethnic diversity among others.  Participants hold up cards with slogans that promote better protection of the rights of immigrant workers, during an event marking International Migrants Day in Seoul in December, 2015. On average, the surveyed Koreans showed a tolerance level of 53.95 out of 100 – with 100 being the most tolerant. This was a 2.78 points increase from 2011. The research findings also showed that tolerance levels were lower than average among Koreans who are low-income earners, those with low education levels and housewives.Ahn said Korean farmers, fishermen and construction workers, as well as those who belong to the same socioeconomic class, may feel that they need to “compete” against migrant workers. According to Statistics Korea, about 90 percent of migrant workers in South Korea are employed in occupations that require physical labor, including farming and fishing. More than 70 percent of all foreign-born workers in South Korea’s farming industry are male, according to the International Organization for Migration’s 2013 report. “Our research showed that Koreans, regardless of their education levels and occupation, who have foreigners as friends, colleagues at work, or relatives, have a high level of tolerance towards immigrants,” Ahn told The Korea Herald. “But those who work in those particular industries – farming, fishing and construction – had lower tolerance levels .”Currently, South Korea’s Employment Permit System, which was introduced in 2007 to attract more foreign workers to the country, makes it nearly impossible for those under the scheme to be granted permanent or long-term residency. The permit is limited to a maximum of 4 years and 10 months. Individuals must live in South Korea for five consecutive years and have general knowledge of the Korean culture and language to become a naturalized South Korean citizen.Given such criteria, the easiest – and practically the only – way to acquire South Korean citizenship is through marriage to a South Korean national. As a result, more than 80 percent of foreign-born marriage migrants in South Korea are women. Kang Mi-ok, assistant professor at Utah Valley University in the U.S., pointed out that South Korea’s immigrant policies are discriminatory against foreign laborers and support international marriages between Korean men and women from overseas. In her book, “Why the  Conservatives Chose Multiculturalism,” she argued that migrant women were thought to be easier to assimilate into Korea’s patriarchal system and that there are not enough efforts made to protect migrant workers from workplace abuse and discrimination.  The research also found that 60.4 percent of Koreans think job opportunities should be given to Korean nationals first instead of foreign-born workers when the job market is down. Also 31.8 percent of them did not want to have immigrants as neighbors. At the same time, a very low number of South Korean adults have participated in educational or social activities on multiculturalism, the report showed. Only 5.5 percent of them have taken classes on pluralism and diversity and 4.2 percent have volunteered at multicultural events or institutions.Researcher Ahn also added that many surveyed Koreans had prejudiced views toward foreigners based on their country of origin. For example, many agreed to such statements: “Workers from first-world nations would be better at their jobs at work than those from developing countries” and “It’s better to make friends with those whose first language is English.” By Claire Lee","migrants survey south koreans ,korean farmers laborers less ,korean farmers laborers ,threatened by migrant workers ,farmers laborers less tolerant","['South Koreans', 'the Gender Ministry', 'South Korea', 'South Korea ’s']",14,"[ 0.          0.          0.         ... -0.36223853  0.39974338
  0.08795544]",Claire Lee,Social affairs,3,2016,"percent of koreans think job ,many surveyed koreans had prejudiced ,korean farmers fishermen and construction ,housewives ahn said korean farmers ,said korean farmers fishermen","['South Koreans', 'the Gender Ministry', 'South Korea', 'South Korea ’s', 'Ahn Sang - soo', 'Korea Women ’s Development Institute', 'South Koreans', 'Seoul', 'Koreans', 'Koreans', 'korean', 'Statistics Korea', 'South Korea', 'South Korea ’s', 'the International Organization for Migration ’s 2013', 'Koreans', 'the Korea Herald', 'South Korea ’s', 'South Korea', 'korean', 'south korean', 'south korean', 'south korean', 'South Korea', 'Kang Mi - ok', 'Utah Valley University', 'U.S.', 'South Korea ’s', 'korean', 'Korea', 'Koreans', 'korean', 'south korean', 'Researcher Ahn', 'Koreans', 'Claire Lee']",4,"[ 0.          0.          0.         ... -0.36223853  0.39974338
  0.08795544]"
136,136,136,Koreans more accepting of immigrants than before,"South Koreans have become more accepting of immigrants than four years ago, but there are still rooms for improvement, a government survey showed Monday.The Ministry of Gender Equality and Family said it has developed an index measuring the level of people's open-mindedness toward multicultural members of society. It takes into account eight factors, including whether the person perceives himself or herself as a glob...","South Koreans have become more accepting of immigrants than four years ago, but there are still rooms for improvement, a government survey showed Monday.The Ministry of Gender Equality and Family said it has developed an index measuring the level of people's open-mindedness toward multicultural members of society. It takes into account eight factors, including whether the person perceives himself or herself as a global citizen and willingness to befriend a foreigner.South Korean adults scored 54 out of 100 points on the index in a survey conducted between September and November, up 2.8 points from four years ago, the poll designed by the ministry and conducted by Gallup Korea showed.The younger the respondent, the more likely he or she was to be open to other cultures. Adolescents scored 67.63 points, followed by those aged 20-29 with 57.70 points and those in their 30s with 56.75 points.Participation in cultural events positively correlated with cultural tolerance. Those who have been educated on multiculturalism just once scored 56.29 points, but those who took such courses three times scored much higher at 64.03 points.Compared with other developed countries, however, South Korea was behind in cultural tolerance. For instance, some 60 percent of Koreans agreed that more jobs should be given to Korean nationals than others during recessions, according to the World Value Survey conducted from 2010 to 2014. Americans and Australians were more or less divided on the subject, with the Swedes showing the greatest tolerance with 14.5 percent.The least tolerant groups in Korea were those who have immigrants as neighbors and those who work mostly with immigrants.That's because sharing a living space and competing for jobs probably reinforces a negative image of immigrants, the ministry said.With more than 820,000 members of multicultural families and 1.7 million foreigners in South Korea, ""moving towards a multicultural society has become the natural course of Korean life,"" Gender Minister Kang Eun-hee said in a statement. ""True social integration happens when no one gives a second thought to the word 'multiculturalism.'""The minister vowed to implement policies specific to each demographic to better engage the people and expand programs that increase exchanges between immigrants and Koreans.Some 4,000 adults aged 19-74, as well as 3,640 adolescents in middle and high schools, were interviewed for the survey, which is the first Statistics Korea-licensed study on the subject. It had a Cronbach's alpha of 0.91 for adults and 0.94 for adolescents, meaning the scales used in the survey are highly reliable.","koreans more accepting ,koreans more accepting of ,koreans have become more ,more accepting of immigrants ,than before south koreans","['South Koreans', 'the Ministry of Gender Equality and Family']",14,"[ 0.          0.          0.         ... -0.61986452  0.82853866
 -0.22763343]",KH디지털2,Social affairs,3,2016,"korean adults scored 54 out ,south korean adults scored 54 ,60 percent of koreans agreed ,korean life gender minister ,korean adults scored 54","['South Koreans', 'the Ministry of Gender Equality and Family', 'south korean', 'Gallup Korea', 'South Korea', 'Koreans', 'korean', 'the World Value Survey', 'american', 'Australians', 'swede', 'Korea', 'South Korea', 'korean', 'Gender', 'Kang Eun - hee', 'Koreans', 'Statistics Korea']",1,"[ 0.          0.          0.         ... -0.61986452  0.82853866
 -0.22763343]"
