,Unnamed: 0,Unnamed: 0.1,title,description,body,keyword,ne,cluster,vector,author,section,month,year,keyword_e,ne_e,cluster_e,vecctor_e
45,45,45,Spending on overseas tuition down 7.6% in H1,"The amount of money South Koreans spent on education abroad dropped 7.6 percent in the first six months of this year from a year earlier, central bank data showed Sunday, amid the declining number of South Koreans studying abroad.South Koreans studying abroad spent a total of US$1.57 billion in the January to June period, compared with $1.7 billion in the first half of last year, according to the data released by the...","The amount of money South Koreans spent on education abroad dropped 7.6 percent in the first six months of this year from a year earlier, central bank data showed Sunday, amid the declining number of South Koreans studying abroad.South Koreans studying abroad spent a total of US$1.57 billion in the January to June period, compared with $1.7 billion in the first half of last year, according to the data released by the Bank of Korea.The reading -- which includes spending by exchange students and language school students -- has been in the decline for three straight years.The reduction in spending came as the number of South Koreans studying abroad has dropped in recent years due mainly to the lack of benefits in getting jobs after graduating from foreign universities.A total of 214,696 South Koreans studied abroad last year, down 2.2 percent from 2014, according to the BOK.Separate data compiled by the Ministry of Education showed 10,907 elementary, middle and high school students left South Korea for schools overseas between March 2014 and February last year, down 12 percent from the same period the previous year.","education abroad dropped percent ,money south koreans spent ,abroad dropped percent in ,abroad dropped percent ,koreans studying abroad spent","['South Koreans', 'South Koreans', 'South Koreans']",14,"[ 0.          0.          0.         ... -0.53255242  0.66677433
 -0.07172751]",KH디지털2,Education,8,2016,"education abroad dropped percent in ,south koreans studied abroad last ,koreans studied abroad last ,on education abroad dropped percent ,last year down 12 percent","['South Koreans', 'South Koreans', 'South Koreans', 'the Bank of Korea', 'South Koreans', 'South Koreans', 'the Ministry of Education', 'South Korea']",3,"[ 0.          0.          0.         ... -0.53255242  0.66677433
 -0.07172751]"
46,46,46,Slow digitization of birth records hinders adoptees’ searches,"The number of Korean adoptees who requested to see their birth records increased dramatically from 2012-15, since the revision of the adoption law here, but a lack of digitization is slowing access to the information.Only 35 percent of the some 230,000 relevant documents have been digitized and archived by the government.According to the Ministry of Health and Welfare, the number of adoptees who asked to see their bi...","The number of Korean adoptees who requested to see their birth records increased dramatically from 2012-15, since the revision of the adoption law here, but a lack of digitization is slowing access to the information.Only 35 percent of the some 230,000 relevant documents have been digitized and archived by the government.According to the Ministry of Health and Welfare, the number of adoptees who asked to see their birth records increased from 258 in 2012 to 1,324 last year. In total, 4,790 adoptees requested their records from 2012-15, but only 14.7 percent of them were able to reunite with their birth families, according to data released by Rep. Lee Jong-kul of the Minjoo Party of Korea.Since 2013, the Korean Adoption Services has been digitizing birth record documents housed by adoption agencies here. Of the 230,000 documents, only 79,653 have been digitized as of this year. Adoptees whose records are not archived by the KAS are often left with the only option of visiting the agency personally to access records. Some of them might even have no agency to visit as it might no longer be in business.Several adoptees have suggested that even if the digitizing process is completed, it may not be able to help them search for their birth families. Many adoption papers have false information, such as false names -- both the names of the child and their birth parents -- and incorrect birthdates, which make it difficult for many adoptees to reunite with their birth families. Still, Kim Eun-hee, the head of the Korean Unwed Mothers Families Association which advocates birth mothers’ rights, said digitization of the documents is crucial as it at least gives information on which agency is responsible if an adoptee finds out that his or her records were fabricated. “That’s still an important information I think,” she told The Korea Herald. “This way at least adoptees will know the very first agency that created their records, whether they are false or not.”Kristin Pak, an adoptee who is with Adoptee Solidarity Korea – a group of adopted Korean adults living and working in Korea -- agreed with Kim. She argued that some adoption agencies forged the documents to make each child “adoptable,” and to keep the supply of children flowing while laundering their identities. Children who were younger, “orphaned” or “abandoned” – even when their biological parents were alive – and those without siblings were considered more “adoptable” than others, she explained. “The agencies should be held accountable for falsifying the files,” she told The Korea Herald. Hanna Johansson, a Korean adoptee in Sweden, said archiving hard copies of adoption files was also necessary. “I think being able to see, touch and smell our own history is important, too,” she told The Korea Herald. “You can’t do that in a digital archive.”Pak from ASK said the South Korean government should be in charge of DNA testing with an outreach campaign, on top of archiving the documents, to help those who wish to reunite with their birth families. “The government can cross reference with missing persons reports ,” she said.By Claire Lee","birth records hinders adoptees ,slow digitization of birth ,number of korean adoptees ,records hinders adoptees searches ,birth records increased dramatically","['korean', 'the Ministry of Health and Welfare']",14,"[ 0.          0.          0.         ... -0.64218295  0.47060233
  0.17131218]",Claire Lee,Social affairs,8,2016,"the korean unwed mothers families ,records increased dramatically from 2012 ,since 2013 the korean adoption ,total 790 adoptees requested their ,korean unwed mothers families","['korean', 'the Ministry of Health and Welfare', 'Lee Jong - kul', 'the Minjoo Party', 'Korea', 'the Korean Adoption Services', 'KAS', 'Kim Eun - hee', 'the Korean Unwed Mothers Families Association', 'the Korea Herald', 'Pak', 'Adoptee Solidarity Korea', 'korean', 'Korea', 'Kim', 'the Korea Herald', 'Hanna Johansson', 'korean', 'Sweden', 'the Korea Herald', 'ASK', 'south korean', 'Claire Lee']",3,"[ 0.          0.          0.         ... -0.64218295  0.47060233
  0.17131218]"
47,47,47,Half of married Korean men have cheated: study,"More than half of married Korean men have had extramarital affairs at least once in their lives, while 40 percent of them think “buying sex is not cheating,” a study showed on Monday. The study was jointly compiled by Lina Korea -- the Korean unit of U.S. insurance giant CIGNA -- and a local sexologist clinic, and surveyed some 1,100 Koreans aged 20 or older. The study found that 50.8 percent of the surveyed men, a...","More than half of married Korean men have had extramarital affairs at least once in their lives, while 40 percent of them think “buying sex is not cheating,” a study showed on Monday. The study was jointly compiled by Lina Korea -- the Korean unit of U.S. insurance giant CIGNA -- and a local sexologist clinic, and surveyed some 1,100 Koreans aged 20 or older. The study found that 50.8 percent of the surveyed men, and 9.3 percent of the surveyed women, have cheated on their legal spouses at least once.  123rfThe study also found that the surveyed Korean men in their 50s had extramarital affairs with an average of 12.5 partners. At the same time, 53.7 percent of the men in their 50s said they’ve cheated on their wives. Among surveyed women in their 50s, 9.6 percent said they’ve had affairs while married. They on average had relationships with 4.3 partners. The study also revealed that men and women have different views on whether or not paying for sex is cheating. While 40.5 percent of the surveyed men said they don’t consider buying sex as an act of infidelity, only 15.1 percent of the women thought the same. Notably, 43.3 percent of the respondents that did not consider paying for sex as cheating had extramarital affairs at least once. However, 20.9 percent of those who considered buying sex as cheating -- in the same way as having an affair -- still pursued extramarital relationships. Income level, on top of gender, also had an impact on his or her likelihood of cheating. Among those whose household income is 5 million won  or more, 34.1 percent of them have cheated on their spouses, while 25.4 percent of those whose household income is 3.5 million won or less have engaged in extramarital relationships.In terms of occupation, the highest proportion of those who have cheated, 40.6 percent, were running their own businesses. The second largest group, accounting for 39.3 percent, were office workers, followed by physical laborers who accounted for 33.8 percent.South Korea’s Constitutional Court legalized adultery last year, abolishing a 60-year-old law that made extramarital affairs illegal and punishable with a prison term. Prostitution still remains illegal.Since 2004, the year South Korea passed its antiprostitution law, both buying and selling sex is considered a criminal activity and punishable with a maximum of one year behind bars. By Claire Lee","half of married korean ,married korean men have ,korean men have cheated ,married korean men ,of married korean men","['korean', 'Lina Korea', 'korean', 'U.S.', 'CIGNA', 'Koreans']",14,"[ 0.          0.          0.         ... -0.6322571   0.61667287
  0.35060403]",Claire Lee,Social affairs,8,2016,"half of married korean men ,than half of married korean ,half of married korean ,married korean men have had ,some 100 koreans aged 20","['korean', 'Lina Korea', 'korean', 'U.S.', 'CIGNA', 'Koreans', 'korean', '’ve', 'South Korea ’s', 'Constitutional Court', 'South Korea', 'Claire Lee']",1,"[ 0.          0.          0.         ... -0.6322571   0.61667287
  0.35060403]"
48,48,48,"N. Korean students are required to study more Korean, English, math than S. Koreans peers","North Korean students are required to spend more time studying Korean, English and math than their counterparts in South Korea, a report by the state-run educational think tank said Sunday.The report by the Korea Institute for Curriculum and Evaluation showed that a close examination of the reclusive country's publicized curriculum showed kids were required to allocate more time to the three key subjects compared wit...","North Korean students are required to spend more time studying Korean, English and math than their counterparts in South Korea, a report by the state-run educational think tank said Sunday.The report by the Korea Institute for Curriculum and Evaluation showed that a close examination of the reclusive country's publicized curriculum showed kids were required to allocate more time to the three key subjects compared with students in the South.The mandatory education system and its assessment report compiled by Kim Jin-sook also showed that North Koreans spent more time at school and that the importance of Korean, English, math and science increases in high school. 123rf.""At the middle school level, North Koreans spent 60 hours more studying Korean and 200 hours more studying math, with the North Korean students even spending more school time learning English,"" the KICE report said.The numbers reflect the minimum hours a student needs to take to graduate. It then said while a South Korean high school student will spend about 170 hours on Korean, English and math, a student in the North will have a curriculum requiring 215 hours of Korean, 243 hours of English and 368 hours of math. In the areas of science, a South Korean high school student will need to spend 204 hours, with a North Korean counterpart needing the allocated 799 hours in such fields as physics, chemistry and biology.The report, however, said that while the North did seem to have longer hours, South Korean data reflected the bare minimum and not the actual time students put into a subject. It added that information coming out of the North cannot be verified independently so its accuracy may be in doubt.""South Korean students had more leeway to choose subjects, which causes wide shifts,"" the report claimed.The report also did not take into account extracurricular studies, which are widespread in South Korea.  Despite the difference, the report outlined that the North seems to be moving toward adopting ""international standards,"" which would make it more akin to South Korea's educational structure.In 2012, the North changed its 11-year school system to a 12-year one, and separated middle school and high school. It has taken steps to allow students the opportunity to pick some classes, and intensified its English language programs.On the other hand, the latest assessment made clear that Pyongyang still views education as a tool to sustain the regime.""The education materials always include propaganda aimed at bolstering the regime, and this kind of indoctrination in children's formative years influence how many think later on,"" Kim said.The researcher said these differences in education are something Seoul needs to consider down the line as it seeks unification.","more korean english math ,korean students are required ,english math than koreans ,study more korean english ,korean english math than","['north korean', 'korean', 'South Korea', 'the Korea Institute for Curriculum and Evaluation']",14,"[ 0.          0.          0.         ... -0.17241584  0.77304751
  0.29300249]",임정요,North Korea,7,2016,"hours more studying korean ,korean students even spending more ,60 hours more studying korean ,hours more studying math with ,hours more studying korean and","['north korean', 'korean', 'South Korea', 'the Korea Institute for Curriculum and Evaluation', 'Kim Jin - sook', 'North Koreans', 'korean', 'North Koreans', 'Korean', 'north korean', 'KICE', 'south korean', 'korean', 'korean', 'south korean', 'north korean', 'south korean', 'korean', 'South Korea', ""South Korea 's"", 'Pyongyang', 'Kim', 'Seoul']",8,"[ 0.          0.          0.         ... -0.17241584  0.77304751
  0.29300249]"
49,49,49,N. Korean defectors' wages are 67% of national average: data,"The average wage of a North Korean defector in South Korea stands at 67 percent of what local workers in general take home each month, data by the National Assembly Budget Office showed Sunday.The parliamentary office said North Korean escapees earned 1.54 million won ($1,380) per month in 2015, much less than the 2.29 million won for the country as a whole in the one-year period.The latest findings showed that while...","The average wage of a North Korean defector in South Korea stands at 67 percent of what local workers in general take home each month, data by the National Assembly Budget Office showed Sunday.The parliamentary office said North Korean escapees earned 1.54 million won  per month in 2015, much less than the 2.29 million won for the country as a whole in the one-year period.The latest findings showed that while overall economic circumstances of defectors have been improving, a gap still exists between them and ordinary South Korean workers.In 2011, NABO said the economic activity rate for those that arrived in the capitalist South from the communist country stood at 56.5 percent, and this rose to 59.4 percent as of last year.Employment moved up from 49.7 percent to 54.6 percent, with unemployment dropping to 4.8 percent vis-a-vis 12.1 percent.The data then showed that the percentage of defectors on social welfare, which stood at 62.9 percent in the first year of arriving in Korea, fell to 29.6 percent by the third year of residence.Numbers improved only gradually afterward and dipped to 21.7 percent in the sixth year. Still, it said many defectors had a hard time finding full-time jobs.Even among professionals who were doctors, teachers and researchers in the North, only 51.3 percent were employed in the South, with just 16.8 percent being hired in their original areas of expertise. Government data showed 685 North Koreans who held professional jobs had arrived in the South so far.Among young people, those that gave up their studies have decreased over the years, but the high school dropout rate for defectors stood at 7.5 percent, which is much higher than it is for their South Korean counterparts.""Despite many gains over the years, the latest data on defectors showed the need for more systematic and active support to help those that have escaped the North to become productive members of South Korean society,"" NABO said.","korean defectors wages are ,korean escapees earned 54 ,defectors wages are 67 ,escapees earned 54 million ,korean defectors wages","['north korean', 'South Korea', 'the National Assembly Budget Office', 'north korean']",14,"[ 0.          0.          0.         ... -0.31938636  0.56651497
 -0.19396345]",임정요,North Korea,7,2016,"korean escapees earned 54 million ,south korean workers in 2011 ,north korean escapees earned 54 ,54 million won per month ,korea fell to 29 percent","['north korean', 'South Korea', 'the National Assembly Budget Office', 'north korean', 'south korean', 'NABO', 'Korea', 'number', 'North Koreans', 'south korean', 'south korean']",18,"[ 0.          0.          0.         ... -0.31938636  0.56651497
 -0.19396345]"
50,50,50,Seven out of 10 S. Koreans play video games: survey,"Nearly seven out of every 10 South Koreans enjoy playing some type of video game, a survey showed Saturday, explaining the growing size of the country's game industry.In a recent survey conducted by the state-run Korea Creative Content Agency, 67.9 percent of those surveyed said they regularly played one or more types of video games.The survey was conducted on 3,045 people aged between 10 and 65 years.Stock image...","Nearly seven out of every 10 South Koreans enjoy playing some type of video game, a survey showed Saturday, explaining the growing size of the country's game industry.In a recent survey conducted by the state-run Korea Creative Content Agency, 67.9 percent of those surveyed said they regularly played one or more types of video games.The survey was conducted on 3,045 people aged between 10 and 65 years.Stock imageOut of the total, 60.2 percent said they played mobile games, mostly on their mobile phones, while 38.4 percent said they enjoyed online games on the internet.Less than 8 percent said they enjoyed console games.When asked why they played mobile games, 40.2 percent said simply to spend time, while 17.5 percent said for fun and another 16.5 percent to relieve stress.However, in a separate survey of 620 parents, 54 percent said they believe mobile games interfere with their children's studies.","10 koreans play video ,every 10 south koreans ,video games survey nearly ,koreans play video games ,of 10 koreans play","['Koreans', 'Korea Creative \xa0 Content Agency']",14,"[ 0.          0.          0.         ... -0.58150613  0.53981817
  0.24987903]",김다솔,National,7,2016,"every 10 south koreans enjoy ,they played mobile games mostly ,10 south koreans enjoy playing ,video game survey showed saturday ,played mobile games 40 percent","['Koreans', 'Korea Creative \xa0 Content Agency']",1,"[ 0.          0.          0.         ... -0.58150613  0.53981817
  0.24987903]"
51,51,51,Korean jobless men have hard time getting married: study,"Unemployment affects Korean men’s marriage prospects much more so than women’s, with a vast majority of jobless Korean men in their late 20s and early 30s staying single, a study showed Monday.The report, released by the Korea Women’s Development Institute, discovered that only 4.1 percent of unemployed men aged 25-29 were married as of last year, while 48.8 percent of unemployed Korean women in the same age group...","Unemployment affects Korean men’s marriage prospects much more so than women’s, with a vast majority of jobless Korean men in their late 20s and early 30s staying single, a study showed Monday.The report, released by the Korea Women’s Development Institute, discovered that only 4.1 percent of unemployed men aged 25-29 were married as of last year, while 48.8 percent of unemployed Korean women in the same age group were married. The difference was even larger for jobless men and women aged 30-34. While almost 86.7 percent of unemployed Korean women in the age group were married, only 19.4 percent of jobless men had legal spouses as of 2015.At the same time, the report found that the proportion of married women among those who are unemployed is higher than those who have professional careers. For unemployed women aged 30-34, 86.7 percent were married, while the proportion was 57.2 percent for those in the same age group who were working. The pattern was the opposite for Korean men. While 19.4 percent of unemployed men in the same age group were married as of last year, 54.2 percent of men with careers were living with their legal spouses.  Kim Young-ran, a researcher at the KWDI, said in spite of changing gender roles, men are often expected to be breadwinners of the family in Korean society. “So accordingly, young men who are unemployed are often seen as incapable of supporting his future spouse and children,” she told The Korea Herald. As for why a large proportion of unemployed women are married compared to working women, Kim said it is because many women end up quitting their jobs after getting married, particularly after having children in their early or mid-30s. She also said that many employers are hesitant to hire mothers with young children. “So the ‘unemployed’ women in this data includes married women who once had careers but ended up quitting after getting married for whatever reasons,” she explained. “The data also reflects the trend where many women with professional careers, especially those in their 30s, delay marriage and child bearing. That’s one of the reasons why the proportion of those who are married is smaller among working women than unemployed women.”Kim Jun-kyu, a 33-year-old who works in Seoul, said it is “virtually impossible” for an unemployed Korean man without any savings to get married in Korea, especially because of the nation’s common practice in which the groom’s family buys the house for newlyweds.  “I think the biggest problem is that when you are unemployed, you are ineligible to apply for any bank loans,” he said. “And when you can’t get loans, it’s very difficult to get housing. I know it’s changing, but men are still expected to somehow finance the housing when getting married. Unemployed men can’t do that unless their parents have the financial means to help them.”Kim also said he thinks there is a stigmatization against men who are out of work. “I think having a job is still considered by society as an option, rather than a duty for many women,” he said. “But men, especially those with children, not having a professional career -- or quitting their job -- is not really an option, according to the social norms in Korea. Such fathers are easily considered as incapable or irresponsible.”   By Claire Lee","unemployment affects korean men ,korean men marriage prospects ,percent of unemployed korean ,majority of jobless korean ,affects korean men marriage","['korean', 'korean', 'the Korea Women ’s Development Institute', 'korean']",14,"[ 0.          0.          0.         ... -0.50358206  0.14117596
 -0.05194922]",Claire Lee,Social affairs,7,2016,"percent of unemployed korean women ,unemployment affects korean men marriage ,48 percent of unemployed korean ,86 percent of unemployed korean ,majority of jobless korean men","['korean', 'korean', 'the Korea Women ’s Development Institute', 'korean', 'korean', 'korean', 'Kim Young - ran', 'KWDI', 'korean', 'the Korea Herald', 'Kim', 'Jun - kyu', 'Seoul', 'korean', 'Korea', 'Korea', 'Claire Lee']",5,"[ 0.          0.          0.         ... -0.50358206  0.14117596
 -0.05194922]"
